{
  "schemaVersion": "libre-ai.retention-policy.v3",
  "authority": "urn:libre-ai:decision:adr-0042-auth-minimal-lookup-and-organization-rls",
  "status": "candidate",
  "backupExpiry": "P35D",
  "restoreOrder": ["execution-deletion-tombstone", "orchestrator-execution-record"],
  "authRestore": {
    "discard": [
      "browser-session",
      "auth-session-locator",
      "auth-oidc-transaction",
      "auth-membership-projection",
      "auth-subject-locator"
    ],
    "invalidateCookieAndTransactionEpochs": true,
    "replayDeletionEvidence": true,
    "rebuildFrom": "independently-current-sessions-authority",
    "missingAuthority": "deny-reopening",
    "controllerState": "absent-memory-only",
    "preserveInheritedExecutionRestoreOrder": true
  },
  "rules": [
    {
      "id": "browser-session",
      "owner": "auth-web",
      "dataClass": "browser-session-and-revocation",
      "location": "postgresql",
      "mode": "fixed",
      "trigger": "expiry",
      "defaultRetention": "P1D",
      "maximumActiveHours": 12
    },
    {
      "id": "practices-progress",
      "owner": "practices",
      "dataClass": "learner-progress",
      "location": "local",
      "mode": "until-delete",
      "trigger": "explicit-delete"
    },
    {
      "id": "radar-body",
      "owner": "radar",
      "dataClass": "untrusted-fetch-body",
      "location": "memory",
      "mode": "immediate",
      "trigger": "normalization"
    },
    {
      "id": "radar-quarantine",
      "owner": "radar",
      "dataClass": "failed-fetch-quarantine",
      "location": "cellar",
      "mode": "fixed",
      "trigger": "failure",
      "defaultRetention": "P7D"
    },
    {
      "id": "radar-normalized",
      "owner": "radar",
      "dataClass": "normalized-item-and-decision",
      "location": "postgresql",
      "mode": "fixed",
      "trigger": "creation",
      "defaultRetention": "P90D",
      "configurable": {
        "minimum": "P7D",
        "maximum": "P365D"
      }
    },
    {
      "id": "notebook-content",
      "owner": "notebook",
      "dataClass": "block-link-index",
      "location": "local",
      "mode": "until-delete",
      "trigger": "explicit-delete"
    },
    {
      "id": "boussole-local",
      "owner": "boussole",
      "dataClass": "response-and-result",
      "location": "local",
      "mode": "until-delete",
      "trigger": "explicit-delete"
    },
    {
      "id": "sessions-presence",
      "owner": "sessions",
      "dataClass": "participant-presence",
      "location": "redis",
      "mode": "fixed",
      "trigger": "last-seen",
      "defaultRetention": "P1D"
    },
    {
      "id": "sessions-content",
      "owner": "sessions",
      "dataClass": "session-content-and-outcome",
      "location": "postgresql",
      "mode": "fixed",
      "trigger": "creation",
      "defaultRetention": "P90D",
      "configurable": {
        "minimum": "P7D",
        "maximum": "P365D"
      }
    },
    {
      "id": "model-snapshot",
      "owner": "model-policy",
      "dataClass": "accepted-model-snapshot",
      "location": "postgresql",
      "mode": "while-referenced",
      "trigger": "reference-release",
      "postReferenceRetention": "P5Y"
    },
    {
      "id": "spec-package",
      "owner": "specifications",
      "dataClass": "accepted-spec-package",
      "location": "postgresql",
      "mode": "while-referenced",
      "trigger": "reference-release",
      "postReferenceRetention": "P5Y"
    },
    {
      "id": "mission-record",
      "owner": "missions",
      "dataClass": "mission-event-and-evidence-reference",
      "location": "postgresql",
      "mode": "fixed",
      "trigger": "creation",
      "defaultRetention": "P1Y",
      "configurable": {
        "maximum": "P6Y"
      }
    },
    {
      "id": "operational-log",
      "owner": "operations",
      "dataClass": "content-free-operational-log",
      "location": "logs",
      "mode": "fixed",
      "trigger": "creation",
      "defaultRetention": "P30D"
    },
    {
      "id": "proof-artifact",
      "owner": "proof-artifact",
      "dataClass": "proof-and-artifact-manifest",
      "location": "postgresql",
      "mode": "while-referenced",
      "trigger": "reference-release"
    },
    {
      "id": "encrypted-backup",
      "owner": "backup",
      "dataClass": "encrypted-disaster-recovery-snapshot",
      "location": "backup",
      "mode": "fixed",
      "trigger": "creation",
      "defaultRetention": "P35D"
    },
    {
      "id": "orchestrator-execution-record",
      "owner": "agent-orchestrator",
      "dataClass": "content-free-authorized-execution-state",
      "location": "postgresql",
      "mode": "fixed",
      "trigger": "creation",
      "defaultRetention": "P1Y",
      "configurable": {
        "maximum": "P6Y"
      },
      "effectiveRetentionEqualsRule": "mission-record"
    },
    {
      "id": "execution-deletion-tombstone",
      "owner": "agent-orchestrator",
      "dataClass": "content-free-execution-deletion-tombstone",
      "location": "postgresql",
      "mode": "fixed",
      "trigger": "explicit-delete",
      "defaultRetention": "P35D"
    },
    {
      "id": "auth-oidc-transaction",
      "owner": "auth-web",
      "dataClass": "one-use-oidc-transaction",
      "location": "postgresql",
      "mode": "one-use",
      "maximumActiveSeconds": 600,
      "deleteOn": ["consume-before-provider-exchange", "expiry"],
      "postEventRetentionSeconds": 0
    },
    {
      "id": "auth-session-locator",
      "owner": "auth-web",
      "dataClass": "keyed-session-locator",
      "location": "postgresql",
      "mode": "dependent",
      "dependsOn": "browser-session",
      "deleteOn": ["source-deletion"],
      "invalidateOn": ["source-digest-rotation"],
      "coupling": "atomic",
      "independentRetention": false
    },
    {
      "id": "auth-membership-projection",
      "owner": "auth-web",
      "dataClass": "current-membership-projection",
      "location": "postgresql",
      "mode": "dependent",
      "sourceOwner": "sessions",
      "sourceAuthority": "sessions-current-membership",
      "deleteOn": [
        "source-deletion",
        "source-revocation",
        "projection-invalidation",
        "freshness-unverifiable"
      ],
      "independentRetention": false,
      "historicalSnapshotsAllowed": false,
      "requires": "verified-current-source"
    },
    {
      "id": "auth-subject-locator",
      "owner": "auth-web",
      "dataClass": "verified-subject-locator",
      "location": "postgresql",
      "mode": "dependent",
      "dependsOn": "auth-membership-projection",
      "sourceOwner": "sessions",
      "deleteOn": [
        "source-deletion",
        "source-revocation",
        "projection-invalidation",
        "freshness-unverifiable"
      ],
      "coupling": "atomic-with-projection",
      "independentRetention": false
    }
  ]
}
